{
  "schemaVersion": "1.0.0",
  "plugin": {
    "id": "cursor-harness",
    "name": "cursor-harness",
    "version": "0.2.0",
    "manifestPath": "plugin/.cursor-plugin/plugin.json",
    "manifestSha256": "00097663dabe01429a74d42e0e3520e0f967e220819042ee0b0aafe384b47b42"
  },
  "components": [
    {
      "id": "adversarial-claims-reviewer",
      "kind": "agent",
      "path": "plugin/agents/adversarial-claims-reviewer.md",
      "sha256": "8ef698099d7990cc9c214a17a88a5e7ec2fbf25865145e691c2aed9b9362d2d4"
    },
    {
      "id": "capability-probe",
      "kind": "agent",
      "path": "plugin/agents/capability-probe.md",
      "sha256": "37bf1878f917af9a9fa60bafd57936858dbafed466dcb535d27cca6096bcfc82"
    },
    {
      "id": "code-reviewer",
      "kind": "agent",
      "path": "plugin/agents/code-reviewer.md",
      "sha256": "e02bf447ea41a5836fc44788dab4f804dfd1a5918af7f17eb8df2dc1668bc068"
    },
    {
      "id": "data-model-documenter",
      "kind": "agent",
      "path": "plugin/agents/data-model-documenter.md",
      "sha256": "66a9991d91eb63868c696802f99259a1557fe552fb2e81da63e828643c367d2f"
    },
    {
      "id": "data-model-verifier",
      "kind": "agent",
      "path": "plugin/agents/data-model-verifier.md",
      "sha256": "54e0f16c2f6a0a38975024c8112623d8ecf93169c222039045b0ea1da7e76b6a"
    },
    {
      "id": "devops-engineer",
      "kind": "agent",
      "path": "plugin/agents/devops-engineer.md",
      "sha256": "d83c9d436b53779fe84afa99daecc8fff2e1e888ec85da59ea5d45ad3a9cbcd9"
    },
    {
      "id": "engineer",
      "kind": "agent",
      "path": "plugin/agents/engineer.md",
      "sha256": "43c1ff960eb0562f1a2a2eb2e8583cba8cf774a677b4ee264bff82998fba3cad"
    },
    {
      "id": "game-design-shaper",
      "kind": "agent",
      "path": "plugin/agents/game-design-shaper.md",
      "sha256": "b6bd359b51bbefef6f5ff7176bc8c2b5d28894bac56b1dd12aa5fb98cdea7516"
    },
    {
      "id": "godot-engineer",
      "kind": "agent",
      "path": "plugin/agents/godot-engineer.md",
      "sha256": "b61f542e4e8f138f1dc55e772ed3297a31341f23efa68741553be10847c3d7bf"
    },
    {
      "id": "library-investigator",
      "kind": "agent",
      "path": "plugin/agents/library-investigator.md",
      "sha256": "32303857b2d435abf94aab2c87bd4c084bf5ec2161261b277e37a165b0186f16"
    },
    {
      "id": "library-reviewer",
      "kind": "agent",
      "path": "plugin/agents/library-reviewer.md",
      "sha256": "de7dd9d341e293ae7710f0ce5f993ed37d1e764d88a48dc822f6b5fe1e947655"
    },
    {
      "id": "marketer",
      "kind": "agent",
      "path": "plugin/agents/marketer.md",
      "sha256": "2f61f210b76f640f2ae9544b5a5e718f3eac1c236ed9ac0b12efe3219c4155f8"
    },
    {
      "id": "phaser-engineer",
      "kind": "agent",
      "path": "plugin/agents/phaser-engineer.md",
      "sha256": "67cee9a79cad82971ccd9d94c13dc5faee5f609075f67d350f5281d18ae5db47"
    },
    {
      "id": "rust-engineer",
      "kind": "agent",
      "path": "plugin/agents/rust-engineer.md",
      "sha256": "03d6a8e8af279594a9486067e9c1ea75d63057cd186d471ba6c7e02e7dc17202"
    },
    {
      "id": "security-reviewer",
      "kind": "agent",
      "path": "plugin/agents/security-reviewer.md",
      "sha256": "0623021a85238eacd2562ebdc25c426573cd723c6f5eabfe1b39b79313356cd7"
    },
    {
      "id": "technical-pm",
      "kind": "agent",
      "path": "plugin/agents/technical-pm.md",
      "sha256": "748646156a01c3da37232191b4b8b278f15327a416dccea2581898fc644a48cb"
    },
    {
      "id": "web3-engineer",
      "kind": "agent",
      "path": "plugin/agents/web3-engineer.md",
      "sha256": "8b817ac9c61f9308442a9136567795273bc938cfe8de69f9c32fff643247dd21"
    },
    {
      "id": "agent-new",
      "kind": "command",
      "path": "plugin/commands/agent-new.md",
      "sha256": "e2f5b399dc483ca12bb2031286618ee47eb63e992d663d2851718499dd1bc438"
    },
    {
      "id": "audit-library",
      "kind": "command",
      "path": "plugin/commands/audit-library.md",
      "sha256": "c2716c870f805fd6768abb8cdc2e6589515ea584af96f5ebf5538460943d840e"
    },
    {
      "id": "eval-harness",
      "kind": "command",
      "path": "plugin/commands/eval-harness.md",
      "sha256": "edab4ae6697d3409b0cc7da334758f6f2ea74b2b9a37eb7053db440559f14421"
    },
    {
      "id": "openspec-apply",
      "kind": "command",
      "path": "plugin/commands/openspec-apply.md",
      "sha256": "a499f6332ffaab4298467af5ede864eca251ac7d2dfa9cfe78508deb0f71ac78"
    },
    {
      "id": "openspec-archive",
      "kind": "command",
      "path": "plugin/commands/openspec-archive.md",
      "sha256": "fad291b8ba917ecbada510ef31eb83691ac27ff01a30b05b42c6b36e0d1ea677"
    },
    {
      "id": "openspec-propose",
      "kind": "command",
      "path": "plugin/commands/openspec-propose.md",
      "sha256": "df86bf5ea26d5338095d58ae9d99d414161f0c109ec6c936b1dca2bd14860178"
    },
    {
      "id": "review-gate",
      "kind": "command",
      "path": "plugin/commands/review-gate.md",
      "sha256": "3c09ac5e0a9770a1c19927017c44e37d04d18733282bc43012ad9c0472a5e264"
    },
    {
      "id": "skill-new",
      "kind": "command",
      "path": "plugin/commands/skill-new.md",
      "sha256": "9b60471fbdce034d1c398d6e6435e59f22e4df863fd520de0e8bae041f92fbc8"
    },
    {
      "id": "state",
      "kind": "command",
      "path": "plugin/commands/state.md",
      "sha256": "eaa90c6cb6a0f3b9ba5d55abd16c03e3fda21feac8015ef5595be4920221c61e"
    },
    {
      "id": "triage-findings",
      "kind": "command",
      "path": "plugin/commands/triage-findings.md",
      "sha256": "c316f81254ea563c9d2f86fbdc26f96795d4e26029b4aad087caf99da880d839"
    },
    {
      "id": "hooks",
      "kind": "hook",
      "path": "plugin/hooks/hooks.json",
      "sha256": "977e590b19cb1eea2e6bbfa44b0b3f4891287b5ccaa1c4368d1936b79dad85f3"
    },
    {
      "id": "actual-diff-verification",
      "kind": "rule",
      "path": "plugin/rules/actual-diff-verification.mdc",
      "sha256": "c80aa8a2dde620f46ade150ddca6801c0836f7e684b0525ce5eb6780df4af63c"
    },
    {
      "id": "anti-patterns",
      "kind": "rule",
      "path": "plugin/rules/anti-patterns.mdc",
      "sha256": "6d57dd3a47b721f6dd6ecce88d5702c42541c8a57524468e304c30e32be75af8"
    },
    {
      "id": "briefing",
      "kind": "rule",
      "path": "plugin/rules/briefing.mdc",
      "sha256": "d6015637fa9fa8fcaeb6d6bab4914b8a177505761ad5c38eda1cd9093bf27d72"
    },
    {
      "id": "communication",
      "kind": "rule",
      "path": "plugin/rules/communication.mdc",
      "sha256": "736ed0615745d34ac5dbd2321b9ac0c4d4e3665cb0d66b8737c2d6116ed5b0f0"
    },
    {
      "id": "evidence-review-tiers",
      "kind": "rule",
      "path": "plugin/rules/evidence-review-tiers.mdc",
      "sha256": "fd36bb8c4ca029f2ef2d1558334cba92eb0a934232d0c4ed678ce54bc53bd82f"
    },
    {
      "id": "factual-correctness",
      "kind": "rule",
      "path": "plugin/rules/factual-correctness.mdc",
      "sha256": "d781e124f331bfb9da537d35c39049b37a580d936bdfb01c9550977e78dfcaa2"
    },
    {
      "id": "grounding",
      "kind": "rule",
      "path": "plugin/rules/grounding.mdc",
      "sha256": "882451c27780231580fb9deadaa849fea8dbedf1223904852baa881e78380c3c"
    },
    {
      "id": "memory-discipline",
      "kind": "rule",
      "path": "plugin/rules/memory-discipline.mdc",
      "sha256": "d2c6f5b87f3a3b70bd21aa432aed67db81ecfddce20dcf19f7e87c0fb66c105a"
    },
    {
      "id": "orchestrator-first",
      "kind": "rule",
      "path": "plugin/rules/orchestrator-first.mdc",
      "sha256": "1235938fd6a8847cfe924f39a2ec7aaf644d1f213e87cca89ee40500e423dbd5"
    },
    {
      "id": "before-shell-execution",
      "kind": "script",
      "path": "plugin/scripts/before-shell-execution.mjs",
      "sha256": "808ca763cb6b849f4d5fa83eac7c0bc245f8b4b2571ecf19e769edc2430232d2"
    },
    {
      "id": "dispatch-gate-after-file-edit",
      "kind": "script",
      "path": "plugin/scripts/dispatch-gate-after-file-edit.mjs",
      "sha256": "05bda3304f134b90eec8926393e80c980db8313d593cff00ef263633e7d3a587"
    },
    {
      "id": "dispatch-gate-before-read",
      "kind": "script",
      "path": "plugin/scripts/dispatch-gate-before-read.mjs",
      "sha256": "ea6ef1dd7e74165062a242c79728289957c265a8d7d88c94d8d7ee1167b763ef"
    },
    {
      "id": "dispatch-gate-post-tool",
      "kind": "script",
      "path": "plugin/scripts/dispatch-gate-post-tool.mjs",
      "sha256": "3bd1bf8ba82811f1af4a423dd72c724e9947bc2ccad0b1e6a40380b53d024059"
    },
    {
      "id": "dispatch-gate-pre-tool",
      "kind": "script",
      "path": "plugin/scripts/dispatch-gate-pre-tool.mjs",
      "sha256": "6a036e6afaeac79b610c1212918e5ad93f02b133e761a09e4c3818f49db6375d"
    },
    {
      "id": "dispatch-gate-session-init",
      "kind": "script",
      "path": "plugin/scripts/dispatch-gate-session-init.mjs",
      "sha256": "7d9e019aeafc735eacf03c36727b21e98dca88de1f88bf53e635c8964c19df12"
    },
    {
      "id": "dispatch-gate-stop",
      "kind": "script",
      "path": "plugin/scripts/dispatch-gate-stop.mjs",
      "sha256": "9972510b9454c80372a79b84d418b94e4f38631f9cda7c4424d4e823e9624e0c"
    },
    {
      "id": "dispatch-gate-subagent-stop",
      "kind": "script",
      "path": "plugin/scripts/dispatch-gate-subagent-stop.mjs",
      "sha256": "9e875e7c1d1d16cefd554c46fb5eb6a28ea7bd40ff959af579c8f351d6fb3b77"
    },
    {
      "id": "dispatch-gate-lib",
      "kind": "script",
      "path": "plugin/scripts/lib/dispatch-gate-lib.mjs",
      "sha256": "6ff60938ec33ef5e66dffef6b184c83f63ae5210f7ac75cb066906f90de00f04"
    },
    {
      "id": "dispatch-gate-plan-lib",
      "kind": "script",
      "path": "plugin/scripts/lib/dispatch-gate-plan-lib.mjs",
      "sha256": "88c8844449e528538b16c4371c545df58b8f57e26eb51425f573b7aaab08ec7a"
    },
    {
      "id": "verify-ledger-lib",
      "kind": "script",